{
  "$schema": "https://json-schema.org/draft/2020-12/schema",
  "$id": "urn:game-agent:operations:contracts:v1:gamelift-capacity-authorization",
  "title": "GameLift Capacity Adjustment Authorization Decision 1.0",
  "$comment": "Additive trusted E2 authorization decision for gamelift.capacity-adjustment/1.0. It records the six ADR 0001 authority inputs, the deterministic effective authority (their minimum), and one of authorized/approval_required/denied. For E2 GameLift capacity changes a non-denied decision is always approval_required: the model and UI cannot bypass a direct human approval. It reuses the immutable common $defs and is not part of the published source-control write-contract schema set.",
  "type": "object",
  "additionalProperties": false,
  "required": [
    "authorization_contract_version",
    "decision_id",
    "phase",
    "prepared_operation_hash",
    "principal",
    "authority_inputs",
    "effective_authority",
    "decision",
    "reason_codes",
    "policy_version",
    "evaluated_at",
    "expires_at",
    "correlation",
    "required_execution_authority"
  ],
  "properties": {
    "authorization_contract_version": {
      "$ref": "urn:game-agent:operations:contracts:v1:common#/$defs/contract_version"
    },
    "decision_id": {
      "$ref": "urn:game-agent:operations:contracts:v1:common#/$defs/identifier"
    },
    "phase": {
      "type": "string",
      "const": "advise"
    },
    "prepared_operation_hash": {
      "$ref": "urn:game-agent:operations:contracts:v1:common#/$defs/digest"
    },
    "principal": {
      "$ref": "urn:game-agent:operations:contracts:v1:common#/$defs/trusted_identity"
    },
    "authority_inputs": {
      "type": "object",
      "additionalProperties": false,
      "required": [
        "deployment_mode",
        "tenant_policy",
        "workspace_policy",
        "principal_authority",
        "capability_maximum",
        "operation_risk_policy"
      ],
      "properties": {
        "deployment_mode": {
          "$ref": "urn:game-agent:operations:contracts:v1:common#/$defs/authority"
        },
        "tenant_policy": {
          "$ref": "urn:game-agent:operations:contracts:v1:common#/$defs/authority"
        },
        "workspace_policy": {
          "$ref": "urn:game-agent:operations:contracts:v1:common#/$defs/authority"
        },
        "principal_authority": {
          "$ref": "urn:game-agent:operations:contracts:v1:common#/$defs/authority"
        },
        "capability_maximum": {
          "$ref": "urn:game-agent:operations:contracts:v1:common#/$defs/authority"
        },
        "operation_risk_policy": {
          "$ref": "urn:game-agent:operations:contracts:v1:common#/$defs/authority"
        }
      }
    },
    "effective_authority": {
      "$ref": "urn:game-agent:operations:contracts:v1:common#/$defs/authority"
    },
    "decision": {
      "type": "string",
      "enum": [
        "authorized",
        "approval_required",
        "denied"
      ]
    },
    "reason_codes": {
      "type": "array",
      "minItems": 1,
      "maxItems": 16,
      "uniqueItems": true,
      "items": {
        "type": "string",
        "enum": [
          "APPROVAL_REQUIRED",
          "DEPLOYMENT_DISABLED",
          "INSUFFICIENT_AUTHORITY",
          "POLICY_DENIED",
          "TARGET_NOT_ENROLLED",
          "RISK_LIMIT_EXCEEDED",
          "WORKSPACE_MISMATCH",
          "BOUNDS_EXCEEDED"
        ]
      }
    },
    "policy_version": {
      "type": "string",
      "minLength": 1,
      "maxLength": 128
    },
    "evaluated_at": {
      "$ref": "urn:game-agent:operations:contracts:v1:common#/$defs/timestamp"
    },
    "expires_at": {
      "$ref": "urn:game-agent:operations:contracts:v1:common#/$defs/timestamp"
    },
    "correlation": {
      "$ref": "urn:game-agent:operations:contracts:v1:common#/$defs/correlation"
    },
    "required_execution_authority": {
      "type": "string",
      "const": "remediate",
      "$comment": "Immutable minimum execution authority a future E3 executor MUST independently re-verify (mode/policy >= remediate) before any provider write. The E2 authorization runs at advise authority and never elevates this; it must equal the bound prepared operation's required_execution_authority."
    }
  }
}
