{
  "authorization_contract_version": "1.0",
  "decision_id": "authz.op_aaaaaaaaaaaaaaaaaaaaaaaaaa",
  "phase": "advise",
  "prepared_operation_hash": "sha256:404ee4676bcb2b011e841b067325691c4937a4e3e2bb0e6748bd9632e70248a8",
  "principal": {
    "subject_id": "subject.operator-1",
    "client_id": "client.web-console",
    "tenant_id": "tenant.default",
    "workspace_id": "workspace.default"
  },
  "authority_inputs": {
    "deployment_mode": "operate",
    "tenant_policy": "operate",
    "workspace_policy": "operate",
    "principal_authority": "remediate",
    "capability_maximum": "remediate",
    "operation_risk_policy": "operate"
  },
  "effective_authority": "remediate",
  "decision": "approval_required",
  "reason_codes": [
    "APPROVAL_REQUIRED"
  ],
  "required_execution_authority": "remediate",
  "policy_version": "2026-09-01",
  "evaluated_at": "2026-09-21T19:11:52Z",
  "expires_at": "2026-09-21T19:26:52Z",
  "correlation": {
    "correlation_id": "corr.prepare-1",
    "request_id": "request.prepare-1"
  }
}
